{"schema_version":"0.2","spec_id":"AWG-SPEC-DECISION-EVIDENCE-SEPARATION","spec_version":1,"artifact_digest":"sha256:a5fe04995486c9eaa1207faa6298a8d4bd1a270bc33cffae6a66a0f6040fdd0e","method":"state-machine","checker":"tools/check_spec.py","status":"pass","properties_checked":["five-record separation","incorrect implementation case","approval versus verification boundary"],"checked_at":"2026-09-17T00:25:00Z","evidence_digest":"sha256:a5fe04995486c9eaa1207faa6298a8d4bd1a270bc33cffae6a66a0f6040fdd0e","scope":"offline decision-to-review evidence lifecycle","limitations":["The finite model does not select review depth for a particular implementation risk."]}
