{"schema_version":"0.2","spec_id":"AWG-SPEC-DISCUSSION-PERSISTENCE","spec_version":1,"artifact_digest":"sha256:9124068e857c9b734cbc8ac59cc8a5be24a4f0262af21f851a7fa3eb82511f29","method":"state-machine","checker":"tools/check_discussion_persistence.py plus tools/check_spec.py","status":"pass","properties_checked":["lossless point records","revision-bound resume","future request classification and AR mapping"],"checked_at":"2026-09-17T15:45:00Z","evidence_digest":"sha256:9124068e857c9b734cbc8ac59cc8a5be24a4f0262af21f851a7fa3eb82511f29","scope":"finite session journal and future-request mapping","limitations":["Validates public journal shape, not filesystem crash guarantees or user intent."]}
