{"schema_version":"0.2","spec_id":"AWG-SPEC-AUTOGEN-SUCCESSOR-COMPARISON","spec_version":1,"artifact_digest":"sha256:899fa4a24373d09228b8d3205b793c0ee8354a4634cc37d20a160a651699bd51","method":"state-machine","checker":"tools/check_spec.py","status":"pass","properties_checked":["maintenance evidence separation","comparison-before-disposition","no runtime dependency claim"],"checked_at":"2026-09-17T00:25:00Z","evidence_digest":"sha256:899fa4a24373d09228b8d3205b793c0ee8354a4634cc37d20a160a651699bd51","scope":"offline comparison and migration lifecycle","limitations":["Maintenance and successor evidence require dated public refresh."]}
