{"schema_version":"0.2","spec_id":"AWG-SPEC-INITIAL-PROJECT-REVIEW","spec_version":1,"artifact_digest":"sha256:018cc3d5f101824d93237d0c1b6417118973b60026803fc5af747734258909bb","method":"state-machine","checker":"state/tools/check_planning_review.py plus tools/check_spec.py","status":"pass","properties_checked":["four versioned before/after planning artifacts","explicit user disposition","stale and missing evidence rejection"],"checked_at":"2026-09-17T14:30:00Z","evidence_digest":"sha256:018cc3d5f101824d93237d0c1b6417118973b60026803fc5af747734258909bb","scope":"finite initial planning review envelope","limitations":["Validates public evidence shape and declared disposition, not user intent or implementation correctness."]}
