{"schema_version":"0.2","spec_id":"AWG-SPEC-ANTI-RUBBER-STAMP","spec_version":1,"artifact_digest":"sha256:c6cbe7dc0f7d5f709d929763bbd08f85862a3be4d9bbdf2901fcf33c725f0851","method":"state-machine","checker":"tools/check_spec.py","status":"pass","properties_checked":["alternative coverage","evidence gaps","rejection affordance"],"checked_at":"2026-09-17T00:40:00Z","evidence_digest":"sha256:c6cbe7dc0f7d5f709d929763bbd08f85862a3be4d9bbdf2901fcf33c725f0851","scope":"offline oracle decision quality lifecycle","limitations":["The finite model does not measure human decision quality."]}
