{"schema_version":"0.2","spec_id":"AWG-SPEC-REUSABLE-GUIDANCE-LIFECYCLE","spec_version":1,"artifact_digest":"sha256:f6c36838120915bd6df22d25267c2b273fd9f594d2174242b996bee43ace01f2","method":"state-machine","checker":"tools/check_spec.py","status":"pass","properties_checked":["expiry boundary","counterexample invalidation","scope revalidation"],"checked_at":"2026-09-17T00:40:00Z","evidence_digest":"sha256:f6c36838120915bd6df22d25267c2b273fd9f594d2174242b996bee43ace01f2","scope":"offline reusable guidance lifecycle","limitations":["Expiry duration must be selected for the project risk and volatility."]}
