{"schema_version":"0.2","spec_id":"AWG-SPEC-CONCEPTUAL-AUTHORING-GATE","spec_version":1,"artifact_digest":"sha256:5b5f7aa8fbade1c5cf2d06188ee5c8c667fa36e52203dce55691da582a6a1fae","method":"state-machine","checker":"tools/check_spec.py plus state authoring checker","status":"pass","properties_checked":["specification-first conceptual authoring","revision-bound evidence","fail-closed unsafe and stale references"],"checked_at":"2026-09-17T01:15:00Z","evidence_digest":"sha256:5b5f7aa8fbade1c5cf2d06188ee5c8c667fa36e52203dce55691da582a6a1fae","scope":"specification-first AR authoring lifecycle","limitations":["The gate validates declared evidence and does not prove implementation correctness or oracle intent."]}
