{"schema_version":"0.2","spec_id":"AWG-SPEC-END-TO-END-ORACLE-EXAMPLE","spec_version":1,"artifact_digest":"sha256:8f69717feb2c217cb0248fd16777641ac4d470517c91067c10a879c273274973","method":"state-machine","checker":"state/tools/check_end_to_end_trace.py plus tools/check_spec.py","status":"pass","properties_checked":["ordered mandatory stages","revision-bound evidence classes","skipped-gate and unresolved-guidance rejection"],"checked_at":"2026-09-17T15:00:00Z","evidence_digest":"sha256:8f69717feb2c217cb0248fd16777641ac4d470517c91067c10a879c273274973","scope":"finite synthetic AWG lifecycle trace","limitations":["Synthetic offline trace does not prove provider integration, user intent, or implementation correctness."]}
