{"schema_version":"0.2","spec_id":"AWG-SPEC-OPENHANDS-DECISION-GATES","spec_version":1,"artifact_digest":"sha256:9f3dea40a7f351f6edfb930fe7f613aefef41245d95fb22be3a89f718b9e33c1","method":"state-machine","checker":"tools/check_spec.py","status":"pass","properties_checked":["high-impact gate","sandbox boundary","revision-bound resume"],"checked_at":"2026-09-17T00:25:00Z","evidence_digest":"sha256:9f3dea40a7f351f6edfb930fe7f613aefef41245d95fb22be3a89f718b9e33c1","scope":"offline OpenHands gate insertion lifecycle","limitations":["No runtime adapter or framework behavior is validated."]}
