{"schema_version":"0.2","spec_id":"AWG-SPEC-DISCUSSION-BATCHING","spec_version":1,"artifact_digest":"sha256:7756a64112d27402154181edfce02ffdae586245acc2ad56356397e7abf6a3e5","method":"state-machine","checker":"tools/check_batched_discussion.py plus tools/check_spec.py","status":"pass","properties_checked":["independent point identity","partial responses","added-proposal evaluation","single batched query"],"checked_at":"2026-09-17T15:30:00Z","evidence_digest":"sha256:7756a64112d27402154181edfce02ffdae586245acc2ad56356397e7abf6a3e5","scope":"finite batched discussion points","limitations":["Validates public packet structure and authorization identity, not user intent or implementation correctness."]}
