{"schema_version":"0.2","spec_id":"AWG-SPEC-DISCUSSION-PACKET-REVIEW","spec_version":1,"artifact_digest":"sha256:1896c23f7cdf33365fabddf1ad68555597d7d6d46d5ee303c66ab1aca082dc86","method":"state-machine","checker":"state/tools/check_discussion_packet.py plus tools/check_spec.py","status":"pass","properties_checked":["per-point alternatives and confidence","revision binding","additional-proposal evaluation and independent responses"],"checked_at":"2026-09-17T14:35:00Z","evidence_digest":"sha256:1896c23f7cdf33365fabddf1ad68555597d7d6d46d5ee303c66ab1aca082dc86","scope":"finite per-point discussion packets","limitations":["Validates public packet structure, not user intent or implementation correctness."]}
