{"schema_version":"0.2","spec_id":"AWG-SPEC-DISCUSSION-RECONCILIATION","spec_version":1,"artifact_digest":"sha256:f250ecb300b3b606e8682e4ff200292f57d8a73d261fdcde2d50969e395a46bf","method":"state-machine","checker":"state/tools/check_reconciliation.py plus tools/check_spec.py","status":"pass","properties_checked":["before/after artifact binding","impact analysis","contradiction, stale, and silent-continuation rejection"],"checked_at":"2026-09-17T14:45:00Z","evidence_digest":"sha256:f250ecb300b3b606e8682e4ff200292f57d8a73d261fdcde2d50969e395a46bf","scope":"finite discussion reconciliation and reopen outcomes","limitations":["Validates public reconciliation evidence and disposition, not the truth of user guidance or implementation correctness."]}
