{"schema_version":"0.2","spec_id":"AWG-SPEC-HITL-TRANSFER-TERMINOLOGY","spec_version":1,"artifact_digest":"sha256:3d5764a1bd39d23b8c067bb447dbbc6d832bb806bbdd01e4d5cf237103914350","method":"state-machine","checker":"tools/check_spec.py","status":"pass","properties_checked":["explicit term mapping","counterexample boundary","conditional transfer"],"checked_at":"2026-09-17T00:25:00Z","evidence_digest":"sha256:3d5764a1bd39d23b8c067bb447dbbc6d832bb806bbdd01e4d5cf237103914350","scope":"offline terminology transfer lifecycle","limitations":["Terminology consistency does not prove behavioral transfer."]}
