{"schema_version":"0.2","spec_id":"AWG-SPEC-SELF-HOSTING-EVOLUTION","spec_version":1,"artifact_digest":"sha256:77ba08dad9b4731b649952c3c0f5b7db7cb56cfd80af67b4995f20d0043302ec","method":"state-machine","checker":"tools/check_spec.py plus state self-hosting checker","status":"pass","properties_checked":["recursive specification-first workflow","trusted seed boundary","separate evidence lifecycle"],"checked_at":"2026-09-17T01:35:00Z","evidence_digest":"sha256:77ba08dad9b4731b649952c3c0f5b7db7cb56cfd80af67b4995f20d0043302ec","scope":"AWG self-hosting change lifecycle","limitations":["The policy and checker establish workflow gates; they do not prove oracle intent, implementation correctness, or runtime safety."]}
