{"schema_version":"0.2","spec_id":"AWG-SPEC-CONFIDENCE-DIMENSION-CALIBRATION","spec_version":1,"artifact_digest":"sha256:b87ed4583547ce9e8f4892c70bec798ece03c70bb5366e2a79244a86685f1c48","method":"state-machine","checker":"tools/check_spec.py","status":"pass","properties_checked":["three-dimension separation","collapsed-score rejection","calibration gate"],"checked_at":"2026-09-17T00:40:00Z","evidence_digest":"sha256:b87ed4583547ce9e8f4892c70bec798ece03c70bb5366e2a79244a86685f1c48","scope":"offline confidence calibration acceptance lifecycle","limitations":["Thresholds remain unvalidated until empirical study."]}
