{"schema_version":"0.2","spec_id":"AWG-SPEC-TUI-CROSS-PROJECT-INTEGRATION","spec_version":1,"artifact_digest":"sha256:3977b1eff9dfe292b37a81af0341fd8fb970c0d344583632e5bf6cb88aab5e9d","method":"state-machine","checker":"tools/check_tui_integration.py plus tools/check_spec.py","status":"pass","properties_checked":["agent/user entry contract","ordered formal/persistence/Coordinator/AWQ events","revision-bound evidence"],"checked_at":"2026-09-17T16:00:00Z","evidence_digest":"sha256:3977b1eff9dfe292b37a81af0341fd8fb970c0d344583632e5bf6cb88aab5e9d","scope":"finite cross-project TUI trace","limitations":["Offline trace does not prove provider integration, terminal behavior, or implementation correctness."]}
